,Clothing ID,Age,Title,Review Text,Rating,Recommended IND,Positive Feedback Count,Division Name,Department Name,Class Name
211,1020,72,,"Very pretty fabric and beautiful color, but i agree with the other reviewer here, the fit is a bit strange. the waist is very small - need to size up at least one size for that to fit - while the rest fits nicely. it's also a little longer than i had expected...sort of looks like it should be a couple inches shorter (and i'm 5'11""!).",4,1,5,General Petite,Bottoms,Skirts
212,1075,52,Classic,"I was so excited about the arrival of my maza dress. much to my surprise the material was not has structured as i thought it would be from the photos. the fit was very tight and did not fall as nicely as i anticipated. because i loved the classic design i decided to give it another chance so i returned it for the next size up and fell in love, the open sleeve was a nice surprise with a touch if elegance. the front buttons added a bit of old charm and feminine
appeal. while the material was not v",4,1,3,General,Dresses,Dresses
213,1104,47,My new favorite dress,"I'm 5'4"", 130 lbs. 34 d. i bought the medium. i think i could have gotten the small but i didn't have time to re-order. it fit fine but could have been a little more snug around my top half. i love the length and the fabric.!",5,1,0,General,Dresses,Dresses
214,1020,67,Not as pictured!,"The skirt that i received had very little blue or green in it, and was mostly white, yellow and some red. the fit was fine but the quality for the price was not there for me. the lack of quality and the disappointment in the quality equals a return.",1,0,17,General Petite,Bottoms,Skirts
215,1094,39,Autumn fever,"Ranna designs richly detailed dresses and this is no exception.  looks just like the pictures (colors/cut/drape) with the exception of a modesty hook at the deep v-neck.  sleeves are sheer with an elastic cuff.  this dress does not stretch--the bodice felt very fitted and tight, especially at the waist band.  runs tts or small; if you're busty/broad shouldered, size up.  it has a dreadful side zip, is fully lined and all synthetic fabric (boo!)  i purchased size 10p, my stats 36c/38-27-35/135#.",5,1,0,General Petite,Dresses,Dresses
216,305,46,Very small,"Bought a large, could barely pull up over my butt. runs extremely small. it's cute but if your not a stick figure, this is not the suit for you.",2,0,0,Initmates,Intimate,Swim
217,828,64,Too cute to pass up!,"Adorable... too chilly now to wear alone & too cute to cover it up! my navy parka or jean jacket will prob be ok w/ it though. size 6 fits me perfectly & looks pretty much on me as in the pic. love plaid & cotton blend tops anyways. ruffles - adorable, & i'm not too big on that but do love this look. when i first removed this top from the packaging it had an odd 'smoky'-like odor, but it's the dye i think. after hanging it for a few days the smell disappeared. i have in mind to wear w/ the pilcr",5,1,3,General,Tops,Blouses
218,1094,30,Falling goddess,"This dress makes you feel like a bohemian goddess.  falls in the right area and absolutely adorable.  the dress is very fragile, handle with care.",5,1,0,General Petite,Dresses,Dresses
219,828,38,,This is my new favorite top! looks and fits as described.,5,1,1,General,Tops,Blouses
220,895,36,Pretty and comfy,"Last minute i needed a family-friendly top for a chilly night, so i tried on a couple of flowy sweaters at retailer and this was the keeper. while i found other styles a bit too boxy or bulky for my short torso, this has a nice a-line shape that gave me a slim profile while still being forgiving, plus the detail up top is feminine and i liked not having fabric piled up around my neck. i am usually a small but wanted this to fit like the model so i sized up to a medium and voila, i am a model. just",4,1,5,General Petite,Tops,Fine gauge
221,1020,52,Perfect skirt,Love all the colors in this skirt and that i can wear it with a tee and flat sandals or a black jacket and heels. easy piece to wear many ways. great quality too.,5,1,1,General Petite,Bottoms,Skirts
222,895,61,,"This tunic trumped any other i have seen this season. the style, with the delicate open stitchwork around the upper chest gave it quite a feminine appeal. i especially love the weight of the fabric being on the light side. won't have to worry about hot flashes like when wearing a thicker fabric! it's warm without being bulky. and to top it off, it was on sale and i was able to grab two colors. this tunic is also age appropriate and flattering for most anyone. extraordinary to say the least.",5,1,0,General Petite,Tops,Fine gauge
223,647,29,"Easy, comfy & cute","I needed a dress that was easy to throw on for summer days and this dress is perfect for that. it's flattering, light weight and unique. i've received a handful of compliments while wearing this dress. i am 5' 6"" 150 lbs, hourglass figure and typically purchase a small or medium (8-10) and chose a small for this dress. i'd say it's still loose on me- which is what i prefer. the scoop neck and cut out allows you wear a normal bra. however, i've noticed i'm more comfortable wearing a camisole or s",5,1,1,General Petite,Intimate,Lounge
224,1025,38,,"The inseam is advertised as 28"", but they are more like 38"". i was hoping they were for short people, but they are for someone with very long legs, event in my tallest heels, i'd have to get them hemmed! just a warning to my short friends out there. the quality, fit, look was great, but way way way too long.",4,1,10,General,Bottoms,Jeans
225,1025,35,Gorgeous,"I love paige brand pants-they are soft, comfortable, and forgiving. i love these, and want them badly. the are still tight all the way to the knee and then go out into a flattering flare-it is difficult to find the perfect fit on something like this-and paige has done a wonderful job for my body.

my store does not carry petite so i tried these on in regular length. they were significantly too long for me (5'3"") probably 3-4 inches to long. i am hoping for a sale so i can buy them in petite for",5,1,14,General,Bottoms,Jeans
226,815,55,Pretty,"This top is really pretty and nice quality. runs big - i went down a size, and its perfect. coloring is more subtle in person than in the photo.",5,1,1,General Petite,Tops,Blouses
227,1066,57,Great crop pant,"So i love pilcro, i wear them all the time and usually size down because they ""grow"" after wearing them. i tried on my usual size in these and felt like they are too tight, not sure if they will get any looser. the material feels really good, lightweight and the stripes are subtle but cute. not sure if i'll keep them or maybe size up,",4,1,3,General,Bottoms,Pants
228,840,55,Cute,"This is a cute top with jeans for spring and summer, or warmer climates - very fresh and airy. the fabric hangs nicely and although it is lightweight, it is not too thin or see through. ii does not get overly wrinkled either. the style is flattering for most body types and it can be dressed up or down. the v neck is just right: not too deep that you feel like you are showing too much cleavage, but deep enough to be feminine and slimming. i normally wear a size s in retailer tops and blouses",4,1,5,General,Tops,Blouses
229,1026,39,Why so long?,"Petite pants hsould be able to fit short peple, but a 32 inch inseam on pants with buttons at the nottom, can't even gegt them hemmed, what a bummer. my inseam is 27 inchess, so i would need a 5 inch heel. otherwise, gorgeous, and waiat fits true to size. thighs a bit snug for musclea, but stretchy enough to fit. thinking about keeping them, but have to find big plaform heeks...",4,1,0,General,Bottoms,Jeans
230,840,39,"Runs large, bohemian","I tried on the petite size in my usual xs, adn i actually have to go down to xxs, i looked overtaken by the shirt. i'm 5'2"" and 115lbs)

cut is flowy and not close to the body, sleeves are narrower, but still ok with athletic built.

color: light one is great for gals with darker complexion and hair, but for my pale self, the darker one was better... but can't go wrong, i ordered both colors and liked both of them.

ruffle is a great addition too...",5,1,13,General,Tops,Blouses
231,1066,46,"Wonderful weight for summer, flattering","I tried these on on a whim because i liked the shirt that they were displayed with in the store and was surprised how much i liked them! they are a great lighter weight alternative to the pilcro hyphen chino. great for hot days of summer.
the subtle vertical stripes go with everything and help elongate the leg. overall a really flattering cut. the waist is not too low and does not create muffin top.",5,1,8,General,Bottoms,Pants
232,840,37,Light & large,"The shirt is absolutely cute looking. but that's just that....looks. i'm 5'2"" size 6 & wears m to l top. i tried on the medium in the store, it was rather flowing. i liked it. but i didn't like how it fit on the underarm area. it hung very low. so i ordered a petite m. still the same. plus the store the lighting was dark so i didn't realize how see through the shirt was too. had to return it.",2,0,1,General,Tops,Blouses
233,1030,29,"Must have, right on trend, but still classic","These jeans! i tried these on, in addition to the high rise paige denim, and these won out hands down. classic flattering fit from mother, with an element of edginess with the frayed hem. these are long enough on me (i'm 5'5') to cuff at the ankle if i don't want a distressed look on a particular day. they are slightly stretchy like other mother denim but not so much that i would size down. i have muscular calves and thighs, but someone who does not could likely size down and be happy with the a",5,1,1,General,Bottoms,Jeans
234,840,83,Pretty but runs large!,"I ordered this top in my usual size and am exchanging it for one size smaller.
it runs very generous, and so the sizing is a little off.
the style and quality are beautiful, so i am anxious to receive the smaller size.",5,1,0,General,Tops,Blouses
235,1066,29,Comfortable & stylish crop pants,"The blush stripes are subtle but they definitely give elongating effect to your legs.

very comfortable pair of crop pants but my calves are definitely feeling tight in there!",5,1,1,General,Bottoms,Pants
236,647,49,Cozy sunday!,"I got a small mauve. the fit is great and the length is perfect for me, just few inches above my knees.
cute and cozy! what more can i aske for!?",5,1,0,General Petite,Intimate,Lounge
237,1066,42,Not what i expected,I have a similar pair of capris from retailer and when i ordered these i thought they were the same in a different color. these are less flattering and i may not keep them.,2,0,0,General,Bottoms,Pants
238,872,63,Fun change from the norm,"Fun detail with the beading and lace! arms are a little longer while the body of the sweatshirt is a little shorter than expected, but that's the style of the piece. the fit was tts with those proportions mind.  the ladies at the store said that if i ordered the size up, it might be a little longer in the body, but that the arms and shoulders would have been the biggest change. the material isn't too thick, so it's a nice lighter layer for fall/spring. really love it!",5,1,0,General,Tops,Knits
239,840,56,,"I love the style of this top, and the longer length would be great with leggings and fitted shorts. it's somewhat fitted on the top yet it's a-line shape gives a full swing at the bottom. the ruffled v-neckline is pretty, and i like the longer length of the short sleeves. but with all these attributes, unfortunately they cut the armholes really big, so when you put your arms forward, the sleeves pull against your arms. i was trying to decide if i should keep it anyway, but for $98 dollars i thin",3,0,20,General,Tops,Blouses
240,1066,55,Perfect for mediterenian summer,Ordered these online and they fit perfectly. i was looking for lightweight pants for hot and humid summer days and this pair is exactly what i needed. the striped pattern is cute and adds some color.,4,1,0,General,Bottoms,Pants
241,647,32,"Loved this, then washed it twice and it fell apart","I loved this dress from the moment i tried it on. so flattering to my postpartum body without being a huge tent. soft fabric, and for a white/lightly striped dress, not sheer. i'm bummed because after washing only twice (followed the instructions to wash) on gentle cycle and low tumble dry, holes started appearing everywhere, both on the cream ribbed hem in the front bottom and all across the chest, in the white part of the fabric only (it looks like the black stripes are holding the holes toget",1,0,3,General Petite,Intimate,Lounge
242,1066,26,Super flattering,"I went ahead and ordered a size up based on previous reviews, but i should have ordered my own size, as they're a bit loose around the waist. the pants are adorable and the pinstripes very flattering, so i definitely recommend them!",5,1,0,General,Bottoms,Pants
243,840,60,,"I really want to love this shirt, but the small is just way too big on me. for reference, i'm a 32d (which is why i didn't want to size down much more than a small), 5'6' and 125 and i'm drowning in this. i'm going to try it with different bottoms and ultimately will keep it because i do love the quality. just size down a couple of sizes!!",4,1,0,General,Tops,Blouses
244,1066,48,Recommend but not for me,"Love pilcro, love the stripes and the length - but this particular pair of capris/crops are super tight fitting. i went up a size from my usual and still felt tight. i guess its just the cut/fabric combo. i wanted it to be a slightly less form fitting feel ...... may work for you, however!",3,1,0,General,Bottoms,Pants
245,872,38,Love this!,"This is exactly what i was expecting. cute, comfortable and casual. there are some gold sequins in the scroll work that i didn't see online. they are super pretty in person.",5,1,0,General,Tops,Knits
246,1066,49,Cute but small,"I tried these on in the store, and they are super cute but run small. i typically wear a size 25 (i'm 5' 5"" and 108 lbs.) and they were too tight for me. i like the fabric and the cut; i think they'd be great one size up. (my store didn't have them.)",3,1,1,General,Bottoms,Pants
247,1115,41,Really nice sweater coat,"Really nice, substantial, fully lined sweater coat. i love the structured look and the faux-leather piping around the zipper and the pockets. quality seems to be very good. it runs true to size, maybe slightly on the small side (especially for larger hips/busts) so if you are in between sizes, go up. i chose small and it's just right; i wouldn't be able to zip around my hips with xsmall. besides the price, which is why i dropped one star, i cannot really find any fault in this sweater coat.",4,1,1,General,Jackets,Outerwear
248,1030,28,,,5,1,0,General,Bottoms,Jeans
249,1018,28,,"Really pretty, but runs at least a full size small.",4,1,0,General,Bottoms,Skirts
250,1026,48,Perfect,I love these pants. i have worn them a number of times already this season. i am 5' so i did have to have them hemmed. i lost the bottom button in the process but there are still 3 or 4 on the pants so i don't think they look odd. i also wear very high boots with these pants so that helps. a crisp white blouse and black leather jacket and i felt like a million bucks!,5,1,1,General,Bottoms,Jeans
251,840,32,Very cute top,"I love this tunic the natural color is just that, this is a tunic so the fit is a little large. i kept it and had it altered because i really do love this top",5,1,0,General,Tops,Blouses
252,1066,29,Super cute pants,These cropped pants are very light weight and super cute. they seem to run just a bit small (i sized up one size from my usual) and don't seem to stretch so a size larger than you generally take may be necessary. the thin pin stripe design is very light in color so they are quite versatile.,5,1,1,General,Bottoms,Pants
253,647,32,"Cute, casual dress","I have this dress on today in white and i am coming back to buy the second color even though pink is not my favorite. great comfy, casual dress that pairs well with a variety of shoes and jewelry to dress it up. highly recommend for summer!",5,1,6,General Petite,Intimate,Lounge
254,840,28,,Size down! i love this item. it goes perfect with leggings but if you are typically a small you would need to order an extra small and so forth. hopefully once i wash this it will shrink some.,5,1,0,General,Tops,Blouses
255,840,51,Runs big!,"Cute, swing top that would be flattering on most. i love the print on the white color and it's so soft. doesn't wrinkle easy. but it does run big! i'm usually a s in retailer but i was drowning in it. so, size down!",4,1,1,General,Tops,Blouses
256,840,44,Stylish and understated elegant,"I purchased this top in a regular small and surprisingly, it fits me very well (i'm 5'2"", 34b, 26 waist, 36 hips). the hem falls about two inches longer than shown on the model. i like the v-neck the most because the ruffles are not too much, and it's not too low cut. i purchased the white color because i think the pattern is unique and it's brighter for spring/summer. i think skinny jeans and ankle boots or wedges would make the look very stylish. by the way, the fabric is super soft (but not w",5,1,1,General,Tops,Blouses
257,1018,43,Pockets!,"This skirt is really beautiful but i agree with the other reviewers; it runs very small. i'm typically an 8 or 10. if i get a 10, there is usually a bit of room in the item. i decided to get a 10 in this skirt, just in case. i got it zipped but would have trouble breathing as the evening wore on. the pockets are wonderful and the fabric is weighty and really lovely.",4,1,0,General,Bottoms,Skirts
258,840,48,Fits like a maternity top,"Fits well through the shoulders and arms, but there is zero waist, and it just looks like a bunch of extra fabric hanging from the top. super cute, but have to return because of that.",3,0,1,General,Tops,Blouses
259,824,37,Love this top,From the picture i wasn't sure how it would fit. got in the mail and i love it. fits snug when you first put it on and get looser as you wear it. definitely should of gotten a large.,5,1,1,General,Tops,Blouses
260,1115,31,Love this coat!,"I was hesitant to purchase this coat because of the price, and when i received it i have to admit i was a little disappointed with the quality of the coat. the sleeves are made out of a soft felted material but i can see this pilling easily. other than that, the silhouette of the coat is perfect...not too boxy! it's also not too heavy so that you can wear it through fall and into the first months of winter. i love it!",5,1,2,General,Jackets,Outerwear
261,840,50,Adorable and flattering,This top is very cute. got it in the lighter color. the fit is great and it will go with many things. if size medium were not out of stock in the blue color i would have purchased that one also.,5,1,0,General,Tops,Blouses
262,878,47,"Cute, but no go!","I really wanted to love this t and was excited to receive it in the mail. i thought i was being realistic in assuming that is would be somewhat sheer given that there doesn't seem to be a woman's white t on the planet that isn't these days, however it was really sheer. the fit was also short and boxy (this coming from a 5'3 woman who is short-waisted) on the plus size the material is extremely soft and the design is cute. maybe if you are younger and don't mind the sheerness it's worth the gambl",3,0,1,General,Tops,Knits
263,984,56,Pretty denim jacket,"This is a perfect jacket over any shirt, tee, or dress. jacket is well made and goes with anything!",5,1,2,General Petite,Jackets,Jackets
264,1104,25,Amazing peach color!,"I ordered this dress in both colors. the peach color is so beautiful in person. i'm planning to wear this dress for our rehearsal dinner at the end of the summer, if i can hold off until then! definitely worth the price.",5,1,6,General,Dresses,Dresses
265,878,63,,,4,1,0,General,Tops,Knits
266,1104,54,Perfection.,"This dress is incredible. i saw a sales girl wearing it in my local retailer and loved it! i bought it in the navy color, it's gorgeous in person, very bright, vibrant colors. i am 5'9 34 c bra 27 inch waist and the s was quite big on my waist. i kept it anyway because the xs has been sold out, and got it taken in a bit. i wore it while vacationing in mexico and it definitely turned heads, if you're thinking about buying this dress, do it, you won't regret it!",5,1,0,General,Dresses,Dresses
267,984,28,Nice quality but too short for my tall frame,Love the look and quality of this jacket. i&amp;#39;d say it fits true to size but it is way too short for me (i&amp;#39;m just under 6&amp;#39; tall). wish these came in tall sizes!,4,1,0,General Petite,Jackets,Jackets
268,866,26,"Cute top, but back is more of a jersey material","I really love the front of this shirt. however, the back of the shirt is more of a jersey material so it doesn't seem to match the front of the shirt. i still wear it and it looks cute, but it threw me off a bit at first.",4,1,0,General,Tops,Knits
269,1104,29,,Absolutely love this dress! fits true to size and makes anyone look fabulous,5,1,0,General,Dresses,Dresses
270,868,61,Nice color,I liked the color of this top but i didn't really like the ruffled stitching around the middle. it looks like someone just tacked on the bottom half. i bought this for my daughter and she likes it. i think it is comfortable and a good top to knock around in.,3,1,0,General,Tops,Knits
271,984,45,Perfect jean jacket,"Per other reviewers, i sized up from a small to a medium and the jacket fits me just right with room for layers. it is short (cropped), but i like where it hits me and is versatile for jeans and dresses.",5,1,1,General Petite,Jackets,Jackets
272,984,39,Great asset,"I have alst year's version,a dn they are essentially the smae, minus some leather parts removed... this jacket is great, the back si a little shorter, so it goes so well with peplum tops an ddresses with higher waists (without looking bigger from the back when the hem is longer and hits where the skirt aprts bulge out). i love hte darker color, i wish it came is super dark rinse...

i usually buy petites, but i never tired on the eptite in this jacket... i am holding myself back to order this on",5,1,7,General Petite,Jackets,Jackets
273,1104,36,Gorgeous,"Bought both colors in xs and soooooo glad i did. this dress is absolutely gorgeous in either color... will have (do to the nice quality) and wear (very stylish) for a loooooong time.

a must have for the summer!!!!!!",5,1,0,General,Dresses,Dresses
274,878,41,Comfy and fun!,"Comfy sweatshirt with fun polka dot details. soft and not baggy. a little on the shorter side so i think i will layer a lace cami underneath and it will look even prettier. i'm 5'7"", 140 pounds with an athletic, hourglass shape, 32dd. i bought the ""2"" which equates to a medium since i wanted it a little looser being a sweatshirt (i'm normally an retailer small but i don't think that would have worked in this case as it would have been too fitted). great comfy weekend piece!",5,1,11,General,Tops,Knits
275,1182,37,Great tee,"I could wear this every day, it is stylish and comfortable",5,1,0,General Petite,Tops,Knits
276,868,55,Pretty and feminine,Pretty top. love the color and the large ruffle. makes it great for layering or with a pretty necklace.,5,1,0,General,Tops,Knits
277,868,83,Sooooooooo cute!,"Love this top!
it is a full/ swing top, but the slightly shorter length balances out the fullness perfectly.
i have been wearing it with a contrasting fitted cami and get tons of compliments.
love both colors, and having fun wearing them.
and after one washing the fullness is softer and looks like the pic.
runs true to size and in the arms slightly tight, so i went with my usual med and fits perfect.
if you have issues with sleeve size would recommend going up a size, otherwise very true to size",5,1,1,General,Tops,Knits
278,868,35,Peplum hem tee,"The styling of this top is really cute. it fits perfectly on the shoulders and gets bigger at the hem for the baby doll look. my biggest complaint is the quality! it's really cheap and feels like the quality i would expect to see at a cheap retailer. it catches lint like crazy and because the hem is just a pearl edge, it curls really badly. i buy quite a bit from here and this is the worst quality item i have seen in a long time. not worth the $$ if paying full price.",3,1,2,General,Tops,Knits
279,565,38,,"Love, love, love this dress. it is very slimming. it hugs you without really touching you. leaving the tie and a few buttons open gives it more of a casual feel.",5,1,3,General Petite,Trend,Trend
280,984,35,So comfortable and chic,"I'm 5'3 130# with a 32dd bust. i usually wear small in retailer/ cloth and stone/ running horses. the small fit me fine, but with no room for layers underneath. the small was very snug. would be perfect for california evenings. but, i live in the north east! the medium still has a great shape on me, still fitted at the waist (27inches), but enough room to wear a light sweater or flannel under. the medium still also looks great over my maxi dress.",5,1,0,General Petite,Jackets,Jackets
281,1104,45,,"This dress is gorgeous!!! i love it! i bought it to wear to a july wedding. i got the navy and it is so fresh and crisp in color. the sizing is on spot! i slipped it on and it was comfortable, easy and stylish. i am 5'7"" and typically xs. it falls exactly as portrayed in the online photos. it is lined in the skirt and the top is stretch jersey in the best weight! i am in love!",5,1,7,General,Dresses,Dresses
282,868,65,,"This shirt is one of my favorite retailer purchases ever! it is well made and is perfect for work or the weekend. the first time i wore it, i received so many compliments!",5,1,4,General,Tops,Knits
