,Clothing ID,Age,Title,Review Text,Rating,Recommended IND,Positive Feedback Count,Division Name,Department Name,Class Name
568,875,33,Cute top!,"This is a very cute and unique top!! i absolutely love the back, which makes up for my indifference of the front. i'm a little heavier in the middle, so it hides it a bit, but the light blue from the back that shows on the sides makes me feel a little wider. it's not perfect, but i like it enough to keep it. i got lots of compliments on it when i wore it. it's very comfortable too. i just wish the front had a little more to it or was a tad longer. overall very happy.",4,1,3,General,Tops,Knits
569,820,39,Love,"This top is so lovely, i was worried of the color on my pale skin, but it is complementary, nice warm tones. yes, it is a tank, but i can see this as a transition piece into fall with a nice blazer, jeans, boots... the xs regular is perfect for me, length is adequate. if i were to go with petite, i might think it is too short. it is flowy, but still has shape, more than a swing top, so very flattering. the back is really cute too, definitely need a strapless for me, due to the thin straps...",5,1,3,General,Tops,Blouses
570,1037,54,Comfortable and unique,"Great pants, like the edginess of the design in the material. kinda rocker like. soft material that's stretchy and hopefully will hold its shape during the day. the color is listed as black but it's more of a dark gray with a slight blue hint.",4,1,4,General Petite,Bottoms,Jeans
571,820,44,,,4,1,0,General,Tops,Blouses
572,1037,39,,"I love these! they are a perfect addition to my fall wardrobe, and just like all other pilcro jeans, they are a great fit and true to size.",5,1,0,General,Bottoms,Jeans
573,820,24,Fits so well!,"I often have a hard time finding items that fit true to size, but this top fits perfectly. it is cut really well and very flattering.",5,1,0,General,Tops,Blouses
574,833,65,,,1,0,0,General,Tops,Blouses
575,1094,64,Stunning special occasion dress,"I'm surprised i'm the first to review this dress! it is a must for the holidays and any special occasion! it is absolutely gorgeous! it is so feminine and seductive; it's one of those dresses that would be stunning on anyone! it is a quality dress, beautifully made, looks just like the photo. i'm 5'9"" & the hemline falls at the top of my knees. the neckline is exquisite & really ""makes"" the dress. i purchased the black version but if i was younger i'd get it in red as it would garner quite a bit",5,1,30,General,Dresses,Dresses
576,833,40,Love this shirt,"This shirt is very nice quality and looks stunning. it does run tight in the shoulder area and is a bit of a challenge getting off, but as long as i don't rip it one of these times all will be well! it looks so nice on that i overlook that design flaw.",5,1,1,General,Tops,Blouses
577,995,39,"Comfortable, soft",The material is very soft and it looks just like it does on the model with the exception that it gets a little wrinkly at the hem and turns up at the corners. i like it and have already worn it a few times.,4,1,0,General,Bottoms,Skirts
578,1094,42,Not for us chesty girls!,"Was drawn to this dress in the store. my location had it displayed well (one mannequin with the dress & a jean jacket...another with the faux fur cardigan). the dress is a very vibrant red. but the fit is not for me. i am busty (34c) with a short torso, and the dress made me look like dolly pardon on top. but there was a lot of room on the bottom. i tried on a size 6 and felt like i needed a size larger on the top and a size smaller on the bottom. having said that, the material is a very good qu",3,0,3,General,Dresses,Dresses
579,875,34,Fit is not cute,"I was really excited about this top since i have others from retailer that are similar in styling. unfortunately, it just didn't work out. i am petite with a short torso and ordered my usual size and it was way too short in the front. the top was also boxy and didn't sit right. it just wasn't flattering. cute top on the hanger, but just not on me.",2,0,2,General,Tops,Knits
580,1037,38,,,3,0,0,General,Bottoms,Jeans
581,875,29,Do not like the front,"The back of this t-shirt looks cute but the front looks really weird. the material in the back is quite stiff but the grey material is soft, so the front gray area ends up hanging weirdly and looking uneven and messy. i appreciate asymmetrical clothing but to me it looked like a patched up rag from the front. it fits true to size.",2,0,3,General,Tops,Knits
582,833,49,Not doing anything for me,"Well, this top just did not do anything for me - it's a very conservative style with the high neckline and blousy fit. you'd need to go a little lower in size if you want any of your figure to show through. i guess it might be good for a church function or some other conservative event, but it was too buttoned-up for my style. i also had a hard time getting it off even though the size i tried on was large for me. i didn't care for the feel of the fabric either, although the lace is nice.",3,0,1,General,Tops,Blouses
583,1060,39,Not for me,Well made. made my hips looks giant. just not my style unfortunately. i'd have to work at preschool or on a ship to pull this off. i'm 5'3 120-123lbssize 6-8. i got the size 6 (not petite cuz they were sold out).,3,0,0,General,Bottoms,Pants
584,1094,48,Cute outfit,"I love the color and the style, however it doesn't look as well as the model as i don't have a small waist like the model does. still overall, i love this dress and it is well made and comfortable",4,1,2,General,Dresses,Dresses
585,835,66,So good,"Love this blouse! its so darn cute. the fabric is soft, flows nicely and is just absolutely stunning without being over the top. it falls at the lower part of my hip. the softness of the fabric would make this easy to tuck in. the body of the shirt, sleeves, cuffs and placket are contrasting florals in black and creamy white. the top part is a brownish burgundy color and the flowers/butterflies are embroidered in goldenrod yellow, peach, creamy white, two mauve tones, turquoise and brown. the li",5,1,2,General,Tops,Blouses
586,1094,25,Love this dress,"I am 5'3"" 130 and curvy and this dress fit me perfectly. it's great for parties and weddings (depending on how formal). the only reason i gave it four stars is because the fabric is a little strange; the ribbing for the squares is almost like a pillowy fabric, and it feels a little bit on the cheaper side but luckily it doesn't look cheap. nonetheless, i love this dress and would definitely recommend!",4,1,0,General,Dresses,Dresses
587,1094,36,Classy little dress,"Love this dress! just wore it last night to an early valentine's dinner. very classy, simple, but gorgeous. i'm a size 2 in just about everything but i always buy a size 4 in retailer dresses because i'm tall (5'9"") and have broad shoulders and a long torso, and sizing up in dresses works better all around. i am also not busty (32b). i did get this in a 4. this dress was a little awkward at first trying to hook and then zip but once i got that down it worked. the hook is right up under your",4,1,0,General,Dresses,Dresses
588,875,46,Awkward style,Fits very strange. odd cut. does not look well on.,2,0,1,General,Tops,Knits
589,823,37,,"This is a beautiful top. it extended longer than i had hoped and a petite size was not available, so i ended up returning it. but it is beautiful and the tassels on the sides make it truly unique.",5,1,1,General,Tops,Blouses
590,835,42,Unique piece / boho chic,"Love this blouse! i took a chance on ordering it and wasn't sure what i would think. this blouse is fabulous!!! it has a boho-chic flair to it in a sophisticated way. it's one of those ""special"" pieces from retailer; elegant, quirky, sophisticated.
the details are great, too. of course the embroidery is beautiful; but there are a couple more fun details. the cuffs on the sleeve have multiple buttons; so that you can button them tight or just enough to roll the cuff once. when the cuff is r",5,1,1,General,Tops,Blouses
591,833,26,My favorite black top.,"This is a timeless top. i loved the overall look of the top and after eyeing it for several days decided to purchase it. warning, the shoulder area is cut small due to the fabric at the top. i am usually a size 12 (because of ddd chest) but i bumped up to a 14 and it was perfect.",4,1,1,General,Tops,Blouses
592,833,33,Super flattering,Love this top! it is super flattering with a long floaty body. i usually wear a 4 but sized up to a 6 due to the reviews and am happy with it but think a 4 would have fit as well.,5,1,2,General,Tops,Blouses
593,820,52,Pretty tank,Love tanks and this one is sweet and flowy. great with jeans/shorts or slacks with a jacket for the office. beautiful yellow floral with fun straps in the back that you can wear with a bra. front neckline is cut narrow so bra straps show but with nude or plastic straps it's not that big a deal.,5,1,0,General,Tops,Blouses
594,835,41,Different than the rest !!!,"This is truly unique top, the  detail around the neck is a nice change!!!",5,1,0,General,Tops,Blouses
595,1060,25,Slimmingly perfect!,"I am 5'2"" 125 pounds and i bought the 4p. the fabric is high quality and does not cling at all but instead drapes and in a very flattering way. add that to the cut of this jumpsuit and you have elongating, very flattering lines. i could not be more pleased and regret not having bought this item earlier, since i would have enjoyed wearing it during the holidays. as other reviewers said, it is adorable and a winner.",5,1,0,General,Bottoms,Pants
596,1037,47,Too bad!,Very nice fabric but disappointed in the stitching on the knees. it looks nice but makes the pants very uncomfortable and tight around the knees. too bad because i love the style and hoped they would work!,3,1,0,General,Bottoms,Jeans
597,820,24,"Very cute, snug fit","Very cute flowy fit. i am generally a size small, 32-d chest. because the material has no give it fits perfectly (just barely) if it was any smaller or i was any larger it would be too small. very cute design.",4,1,0,General,Tops,Blouses
598,1079,32,,"My store had this and i was so intrigued with its nearly $400 price tag that i decided to play dress up. the colors in person match the colors online, so that was nice to see consistency. overall though, i feel like a dress of that price would need to make me feel like a million bucks, which it did not. most items that fit my slender frame are too short, and this was no exception. the xs fit but i wouldn't be doing much moving, walking or dancing in this dress, which brings me to the question of",3,0,5,General,Dresses,Dresses
599,1060,44,Surprisingly retro-adorable,"I saw this online and thought, hmm, no. then saw it in the store, touched it, and the fabric felt so soft. i am normally an 8 petite in cartonnier, but the only sizes available were 4 and 2 regulars in-store. the 4 just looked promising. i thought i'd try it on for laughs. but it is soooo cute i ended up taking it home. the 4 regular fits perfectly on my curvy on the bottom, 5'2, 145 lb figure. my measurements are 34(b)-29-38, and i was shocked how well this fits in a 4 regular! perfect length a",4,1,1,General,Bottoms,Pants
600,875,66,Love,"Great little transitional piece. i bought the blk/blk floral one & it's not your usual top. sort of quirky & one of a kind looking. i think it's crazy comfortable & i just love it! even its a bit chilly outdoors, toss on a scarf round one's neck & head on out. not the kind of top you'd wear with a jacket.",5,1,2,General,Tops,Knits
601,835,64,Western look,This top has a western look with lots of black and some burgundy shades.  it is very cute and the fabric is soft.,5,1,1,General,Tops,Blouses
602,1078,39,Gorgeous quality knit,"I was lucky enough to get a hold of this intarsia sweater dress after the sale and i wish i had purchased this the first time round. it is absolutely stunning, flattering, comfortable and unique! i am 5'3"" and the regular hem fit me just fine at the ankles. i think this dress runs both tts to a bit large so i would size down if your small framed and stay your usual if your busty or broad shouldered. perfectly complements my taupe booties that i already owned and a my taupe maxi sweater that has",5,1,0,General Petite,Dresses,Dresses
603,1037,42,"Wanted to love, but sadly will return.","These run very small!! they are also short, almost like a crop pant. the fit was so weird that i won't even exchange for a bigger size.",1,0,1,General,Bottoms,Jeans
604,820,35,Great top!!,"I purchased this top in a great sale! fits great,true to size i am xsmall-small for reference, purchased small. i ended up putting a bandeau bra on with it to feel more comfortable. it would be great in the fall with a cardigan/ sweater, or a blazer. super cute to wear alone in summer with jeans!!",5,1,0,General,Tops,Blouses
605,1072,59,Lovely but smells like last purchaser's deodorant.,"I am returning the dress because it smells heavily of the last purchaser's deodorant and perfume. it was actually nauseating to put on. i am disappointed with retailer that i was sold this dress, full price, in this condition. otherwise, the dress is lovely. it is true to size. i am 5'5"" 110 lbs and the size 0 was perfect.",5,1,0,General,Dresses,Dresses
606,1094,64,Interesting but awkward to actually wear,"First, my husband had to help me zip up in this interesting but awkward design. the materials is nice, but stiff, so the skirt is quite full. the shoulder idea is interesting, but i would not want to spend an evening in it. to me, not up to the usual ms standard.",3,1,1,General,Dresses,Dresses
607,833,40,"Beautiful, but a few caveats","This is as beautiful in person as online, but the length is shorter than the description, and the arms are tight! although i am 5'1"", i normally wear regular sizes in retailer just fine; however, the 28"" length scared me off, so i ordered a 2p. it says it's 26.25"" long, but it's actually just about 24"". and my normal sized arms struggled to fit into the sleeves - yikes! but it's gorgeous and was purchased with a gift card, so i will keep :-)",4,1,11,General,Tops,Blouses
608,1037,22,Fun jeggings,"These pants are so soft and so comfortable! i was absolutely in love at first sight. however, i got the petite, because i am 5'3, and they were still a little longer than i like my pants to be. i wanted them to hit right above the ankle, just like the photo, however, they are a tad longer. i still love them and they are still as comfy as ever, so i am gonna deal with the length!!",4,1,1,General,Bottoms,Jeans
609,1094,53,Loved in theory,"I just tried on this dress in the store, in red, and i loved the off the shoulder design. the color is just as pictured online (a light poppy red). the neckline began a few inches below my collarbone and was super flattering. however, the skirt portion of this dress flared awkwardly at the hips, causing my hips to look much wider than they really are (and also disturbing the otherwise clean lines of the dress). it seemed to me that there was too much fabric at the back portion of the skirt than",3,0,4,General,Dresses,Dresses
610,995,34,No shape,It looks like you are wearing cargo shorts. really unflattering. avoid buying this skirt,2,0,1,General,Bottoms,Skirts
611,252,35,,,4,1,0,Initmates,Intimate,Swim
612,634,29,Great casual dress to throw on,"I ordered a petite medium in black, and it fit great great. some of the other reviews said it was tight, but i found it pretty loose and flowy. also felt it was plenty of coverage - wore it to work (casual workplace) and transitioned to happy hour beautifully.",4,1,2,General Petite,Intimate,Lounge
613,985,24,Plaid bomb pairs fabulous with everything fall!,"I had been on the hunt for a plaid bomber to rock this fall and this retailer edition bomber surpassed all of my expectations! it literally pairs great with everything fall.. chokers, boots, dresses; you name it! it also fits very true to size. not too fit to your body, and a little loose, but not too loose.. just like a bomber jacket should! i highly recommend this product.",5,1,1,General,Jackets,Jackets
614,1059,37,Great staple!,"I am pear-shaped and often have a hard time finding pants that fit just right. these did the trick!! they are slim in the waist, but have plenty of room for bigger hips. the overall fit is body skimming/hugging, but they are not tight or uncomfortable in any way! and i have no gapping at the waist. the fabric has a slight sheen to it and a little stretch, but they will be a perfect pant for the office. for reference, i am 5'4"", 34/26/38, and i got a 6 regular.",5,1,0,General,Bottoms,Pants
615,985,65,Perfect fall jacket,This jacket is well-made and smart looking. it gave me just the boost i needed today at a difficult meeting. thank you retailer!,5,1,0,General,Jackets,Jackets
616,1059,36,Must have,"Perfect fit. did not lose its shape. thicker material. great quality for a great price. definitely  a wardrobe  staple. can be dressed up or down. work (business) appropriate. fits tts. for reference,  i am 5'0"", 109lbs, and the 00 petite fits perfect. falls right above ankle like pictured. if they had more colours, i would get them too :)",5,1,6,General,Bottoms,Pants
617,634,35,Lounging dress,"This is a great lounging dress or a great beach cover up. i ordered up a size after reading other reviews. although, i feel like my normal size would have been fine probably. i ordered the black and it is not see through. it's very light weight and comfortable. i may even order in another color just because it's so great to wear around the house.",4,1,0,General Petite,Intimate,Lounge
618,1059,27,Perfect fit,"The fit on these pants is just right for me. i have curvy hips and a slender waste and legs. these pants don't gap in the back, as fitted pants often can. easy to dress up or down. the color hasn't held up as well as i hoped, so take care when laundering.",5,1,3,General,Bottoms,Pants
619,252,36,,Ordered the navy and aqua in medium. the aqua fit a lot tighter than the navy seemed to be a different fabric and less stretchy. loved the color on both but returning the the aqua. normally wear size 6,4,1,0,Initmates,Intimate,Swim
620,634,28,Functional casual dress,"Very comfortable fabric and fits nicely. i am 5'10"" like it states the model is, and it falls shorter on me that viewed, but still looks nice. it will be an easy dress to use for different looks.",5,1,1,General Petite,Intimate,Lounge
621,252,46,Best bathing suit!,"When i tried on this bathing suit, i decided to not try on any others. it was just right! i usually find bathing suit shopping difficult and no fun--as i can never find a suitable bathing suit. this suit looks nice/flattering, and i can also move around in it and it stays in place. i purchased it in the navy and i'm going to order it in another pattern as well. it looks modern and classic; it's a chic style. i'm a size 6 in dresses, and i purchased a size 10 in this bathing suit.",5,1,0,Initmates,Intimate,Swim
622,117,70,,I have bought other leggings at retailer and they were fine. these run small. i have to return.,3,1,0,Initmates,Intimate,Legwear
623,117,57,,Love love love these leggings and what an amazing price point!!!,5,1,0,Initmates,Intimate,Legwear
624,634,69,Overpriced but so comfortable,This is a great beach/pool or lounge piece. i debated keeping but couldn't pass up how comfortable it was. hugging without being tight. i will probably only wear it with some sort of layer like a jean jack or tied shirt rather than undone unless on on the beach but it's so comfortable. straps are a bit long.,4,1,12,General Petite,Intimate,Lounge
625,252,28,My new favorite swim suit,"The colors and fit of this suit are even better than described. it is the most comfortable and flattering one-piece i have ever tried on. 

as noted by other reviewers, there is limited support in the chest; this suit will keep you covered but does not provide lift.",5,1,0,Initmates,Intimate,Swim
626,252,36,Perfect suit,"I had been looking for a one-piece that is fashionable yet practical. fabric is beautiful, fit is impeccable, no complaints on lack of support. i find if you tie it tight up top it's very practical. this was the perfect choice for me. i am 5'3"" 120 lbs and ordered the small.",5,1,4,Initmates,Intimate,Swim
627,634,40,Luxurious sleepwear,"This is a very comfortable and sexy sleep dress, the way it drapes. i can see that the type of fabric is not suitable for out and about activities and can catch on snags, etc. very easily. once i relegated it to the nightgown category it became my favorite item to wear and lounge in.",4,1,0,General Petite,Intimate,Lounge
628,1059,80,Please restock!!!,These sold out in my size 16 before i even knew they existed! (probably a great indication that your in-between and plus-size customers are hungry for more options from you). please restock so i can get in on this apparently-perfect pant!,5,1,6,General,Bottoms,Pants
629,838,44,Cute and unique!,"I love this top! i gave it a four star because i wish it were a tad longer. i am short... 5'-1 and it does work for me, but i do tend to like my tops longer. very cute and airy in the back!",4,1,0,General,Tops,Blouses
630,252,36,Great suit for busy moms!,This suit fits like a glove! i've had five kids and am currently nursing my last baby so i was looking for a suit to wear to the beach this summer when i'm just not feeling a bikini. this is it! it's comfortable and not binding easy to nursing and swim in. overall worth the extra splurge. i'm tall too so it was plenty long on my torso.,5,1,3,Initmates,Intimate,Swim
631,838,41,Beautiful top,"Cute top! the bright red crochet shoulders and back add the perfect pop of color to the light blue pinstriped front. it's a little loose and boxy around the bust area but overall i think it's a flattering shape. i got the regular s and don't find it too short. for reference i'm 5'2"", 134 lb, 34b. i often wear petite sizes but due to other reviews mentioning that the top is short i ordered the regular size and am happy with the length and fit.",5,1,2,General,Tops,Blouses
632,838,48,Boxy and short,This top looked super cute online but when it came it was super short and boxy. looked like a tent on me. this one went back the same day it came!,1,0,3,General,Tops,Blouses
633,634,49,,"Comfy easy dress. i bought the black version. fabric is so soft. i wear this around house, but don't hesitate to run out in it if needed. i bought medium so it was roomier and for length since i'm tall. small also fit, but was shorter than i wanted.",5,1,11,General Petite,Intimate,Lounge
634,1059,42,Wanted to love these...but...meh...,"Uncertain about sizing i got both the 4 & the 6...both made me look like a no-asser :( neither fit quite right in the leg. both hit at a weird point in my calf, not cute-short, just off. (i'm 5'8"" and 125#) to quote my husband, ""nope. not feeling these."" that said, they feel great on, seem to be made well, but are heading back to an retailer near you :( sigh. the quest continues :)",3,0,1,General,Bottoms,Pants
635,634,37,Comfy and cute,I love this dress for day and night time. the back detail is cute and works well with a racerback bra. it runs big though. i'm normally a small in dresses and the arm holes are too big in the size small on me. it was also generally too big all over. i like the length and the weight of the fabric. i purchased in the off black color.,4,1,0,General Petite,Intimate,Lounge
636,1008,38,"Vibrant, effortless, beautiful","I had my reservations given that i'm petite (5'2"", 108lbs) and it's midi style. i'm glad that i took a chance. i bought the red motif and it's beautiful. it's wrinkle-free right out of the package. the color is vibrant and the style is classic and effortless. fits true-to-size. great for work with a black tee as shown in the picture.",5,1,4,General,Bottoms,Skirts
637,838,58,,Cute comfortable top. fits well and will look great with skinny jeans.,5,1,0,General,Tops,Blouses
638,620,47,Very cute and comfortable,I got the shorts and the blue motif they're really comfortable and will look cute with a tank top for the weekend.   they true to size them usually a size 4 to 6 and i got a small and that works.,4,1,2,General,Bottoms,Shorts
639,634,36,Super comfy,"I purchased this dress in black and love it. its hot where i live so i am always looking for a lightweight dress that i can throw on either after the pool or out and about. i wore it to an outside concert with sandals and a simple braid, it was perfect! considering ordering it in another color!",5,1,1,General Petite,Intimate,Lounge
640,1059,66,Great basic pants!,Perfect fit! can be dressed up or down! more colors please!,5,1,0,General,Bottoms,Pants
641,1059,51,Great pant,This is a great pant to wear to business and when you just need something more than a jean. not so skinny a 50+ woman can wear comfortably..,4,1,7,General,Bottoms,Pants
642,1059,38,Great staple,"These are great pants. i love the fit and the taper of the leg. these will be my ""go to"" black pants for the fall season!",5,1,0,General,Bottoms,Pants
643,634,40,Beach cover-up,"I got this to wear as a beach cover-up over bathing suits. if you purchased a darker color and were small chested (i.e., you could go braless, since a bra won't work well with the low back and armholes), you might be able to pull this off as a very casual dress. i bought this in a xs in the coral/peach (i'm 5'7"", 129 lbs., 32dd) and it's not super see-through, but i'd never be comfortable wearing it as a dress on its own. as a beach cover-up it's cute and comfortable, but as a dress it would be",4,1,2,General Petite,Intimate,Lounge
